{
  "schema_name": "macos-local-vm-host-interruption-receipt",
  "schema_version": "1.0.0",
  "profile_id": "iar-macos-local-vm-interruption-v2",
  "profile_digest": "sha256:f1b57b17d9de3b2b4de885732b6bef0f3cbf637bcba08dc1dda34724e9b18c4f",
  "controller_profile_id": "iar-macos-local-vm-synthetic-matrix-v2",
  "controller_profile_digest": "sha256:090aa47a283677599daeacba7af9628e1883b368a7bb7f81fedbda5a957f1888",
  "controller_digest": "sha256:1111111111111111111111111111111111111111111111111111111111111111",
  "job_id": "interrupt-contract",
  "interruption_source": "synthetic-job-private-trigger",
  "sleep_observer_installed": true,
  "shared_stop_handler_used": true,
  "synthetic_interruption_requested": true,
  "virtual_machine_stopped": true,
  "controller_reaped": true,
  "stale_job_removed": true,
  "recovery_job_succeeded": true,
  "all_job_state_removed": true,
  "real_host_sleep_observed": false,
  "vm_confined": false,
  "production_admitted": false,
  "analyzer_execution": false,
  "source_retained": false,
  "authority_added": false
}
